<?xml version="1.0" encoding="UTF-8"?>
<xs:schema xmlns:xs="http://www.w3.org/2001/XMLSchema">
  <xs:element name="playlist_tracce">
    <xs:complexType>
      <xs:sequence>
        <xs:element name="associazione" minOccurs="0" maxOccurs="unbounded">
          <xs:complexType>
            <xs:sequence>
              <xs:element name="playlist_id" type="xs:positiveInteger" minOccurs="1"/>
              <xs:element name="traccia_id" type="xs:positiveInteger" minOccurs="1"/>
            </xs:sequence>
          </xs:complexType>
        </xs:element>
      </xs:sequence>
    </xs:complexType>
  </xs:element>
</xs:schema>
